{
  "$id": "urn:aset:schema:aset-component-requirements:0.1-rc1",
  "$schema": "https://json-schema.org/draft/2020-12/schema",
  "additionalProperties": false,
  "properties": {
    "canonical_digest": {
      "pattern": "^sha256:[0-9a-f]{64}$",
      "type": "string"
    },
    "component_id": {
      "pattern": "^(aset\\.[a-z][a-z0-9.-]+|aset.system)$",
      "type": "string"
    },
    "component_version": {
      "const": "0.1-rc1"
    },
    "document_type": {
      "const": "aset-component-requirements"
    },
    "requirements": {
      "items": {
        "additionalProperties": false,
        "properties": {
          "ADRRefs": {
            "type": "string"
          },
          "Approver": {
            "type": "string"
          },
          "Created": {
            "type": "string"
          },
          "Dependencies": {
            "type": "string"
          },
          "FURPSPlus": {
            "type": "string"
          },
          "FitCriterion": {
            "type": "string"
          },
          "ID": {
            "type": "string"
          },
          "ISO25010Characteristic": {
            "type": "string"
          },
          "Level": {
            "type": "string"
          },
          "ModelElementRefs": {
            "type": "string"
          },
          "Modified": {
            "type": "string"
          },
          "Module": {
            "type": "string"
          },
          "NeedID": {
            "type": "string"
          },
          "Notes": {
            "type": "string"
          },
          "Owner": {
            "type": "string"
          },
          "ParentID": {
            "type": "string"
          },
          "Priority": {
            "type": "string"
          },
          "ProfileApplicability": {
            "type": "string"
          },
          "Rationale": {
            "type": "string"
          },
          "RequirementType": {
            "type": "string"
          },
          "Revision": {
            "type": "string"
          },
          "Risk": {
            "type": "string"
          },
          "Statement": {
            "type": "string"
          },
          "Status": {
            "type": "string"
          },
          "Supersedes": {
            "type": "string"
          },
          "TargetRelease": {
            "type": "string"
          },
          "VerificationCaseID": {
            "type": "string"
          },
          "VerificationMethod": {
            "type": "string"
          }
        },
        "required": [
          "ID",
          "Level",
          "ParentID",
          "NeedID",
          "Module",
          "RequirementType",
          "ISO25010Characteristic",
          "FURPSPlus",
          "Statement",
          "FitCriterion",
          "Rationale",
          "Priority",
          "VerificationMethod",
          "VerificationCaseID",
          "Owner",
          "Approver",
          "Status",
          "Revision",
          "Created",
          "Modified",
          "TargetRelease",
          "ProfileApplicability",
          "Dependencies",
          "Risk",
          "ADRRefs",
          "ModelElementRefs",
          "Supersedes",
          "Notes"
        ],
        "type": "object"
      },
      "minItems": 1,
      "type": "array",
      "uniqueItems": true
    },
    "schema_version": {
      "const": 1
    },
    "source_version": {
      "const": "1.5-rc11"
    }
  },
  "required": [
    "document_type",
    "schema_version",
    "component_id",
    "component_version",
    "source_version",
    "requirements",
    "canonical_digest"
  ],
  "type": "object"
}
