{
  "canonical_digest": "sha256:14048b0322c3f8d2f52d264d011489880dfcbc998d56cb2649f0fd798d0bd384",
  "component_id": "aset.core",
  "component_version": "0.1-rc1",
  "document_type": "aset-component-requirements",
  "requirements": [
    {
      "ADRRefs": "ADR-030;ADR-031;ADR-032;ADR-034;ADR-035",
      "Approver": "Project Owner",
      "Created": "2026-08-02",
      "Dependencies": "SYS-006",
      "FURPSPlus": "S",
      "FitCriterion": "Core conformance tests выполняются с заглушками issuer verification и без баз данных других модулей.",
      "ID": "COR-001",
      "ISO25010Characteristic": "Maintainability",
      "Level": "Module",
      "ModelElementRefs": "MOD-CORE;CTX-AUTH;ART-RESOLUTION;ART-PERMIT;ART-CROSSING",
      "Modified": "2026-08-02",
      "Module": "ASET Core",
      "NeedID": "NEED-003",
      "Notes": "",
      "Owner": "Architecture Board",
      "ParentID": "SYS-006",
      "Priority": "MUST",
      "ProfileApplicability": "Core-only+",
      "Rationale": "Derived from NEED-003 and SYS-006.",
      "RequirementType": "Architecture",
      "Revision": "3",
      "Risk": "High",
      "Statement": "Core должен работать без runtime-зависимости от бизнес-состояния Memory, Master, Monade и Model Gateway, принимая только protocol artifacts и trusted receipts.",
      "Status": "APPROVED_FOR_RC9",
      "Supersedes": "",
      "TargetRelease": "1.5-rc11",
      "VerificationCaseID": "VC-COR-001",
      "VerificationMethod": "Inspection and test"
    },
    {
      "ADRRefs": "ADR-030;ADR-031;ADR-032;ADR-034;ADR-035",
      "Approver": "Project Owner",
      "Created": "2026-08-02",
      "Dependencies": "SYS-003",
      "FURPSPlus": "F",
      "FitCriterion": "Schema допускает ровно два verdict; fuzz/error cases никогда не создают Permit.",
      "ID": "COR-002",
      "ISO25010Characteristic": "Functional suitability",
      "Level": "Module",
      "ModelElementRefs": "MOD-CORE;CTX-AUTH;ART-RESOLUTION;ART-PERMIT;ART-CROSSING",
      "Modified": "2026-08-02",
      "Module": "ASET Core",
      "NeedID": "NEED-003",
      "Notes": "",
      "Owner": "Architecture Board",
      "ParentID": "SYS-003",
      "Priority": "MUST",
      "ProfileApplicability": "Core-only+",
      "Rationale": "Derived from NEED-003 and SYS-003.",
      "RequirementType": "Resolution",
      "Revision": "3",
      "Risk": "High",
      "Statement": "Core должен выносить CoreResolution только со значением PERMITTED или PROHIBITED; техническая ошибка не создаёт резолюцию PERMITTED.",
      "Status": "APPROVED_FOR_RC9",
      "Supersedes": "",
      "TargetRelease": "1.5-rc11",
      "VerificationCaseID": "VC-COR-002",
      "VerificationMethod": "Schema test"
    },
    {
      "ADRRefs": "ADR-030;ADR-031;ADR-032;ADR-034;ADR-035",
      "Approver": "Project Owner",
      "Created": "2026-08-02",
      "Dependencies": "SYS-003",
      "FURPSPlus": "+S",
      "FitCriterion": "Permit schema и ledger связывают resolution, submission digest и read/write sets; иной выпуск отклоняется.",
      "ID": "COR-003",
      "ISO25010Characteristic": "Security",
      "Level": "Module",
      "ModelElementRefs": "MOD-CORE;CTX-AUTH;ART-RESOLUTION;ART-PERMIT;ART-CROSSING",
      "Modified": "2026-08-02",
      "Module": "ASET Core",
      "NeedID": "NEED-003",
      "Notes": "",
      "Owner": "Architecture Board",
      "ParentID": "SYS-003",
      "Priority": "MUST",
      "ProfileApplicability": "Core-only+",
      "Rationale": "Derived from NEED-003 and SYS-003.",
      "RequirementType": "Permit issuance",
      "Revision": "3",
      "Risk": "High",
      "Statement": "Core должен выпускать OneShotPermit только как следствие CoreResolution=PERMITTED для точного digest документа и source context dependency set.",
      "Status": "APPROVED_FOR_RC9",
      "Supersedes": "",
      "TargetRelease": "1.5-rc11",
      "VerificationCaseID": "VC-COR-003",
      "VerificationMethod": "Security test"
    },
    {
      "ADRRefs": "ADR-030;ADR-031;ADR-032;ADR-034;ADR-035",
      "Approver": "Project Owner",
      "Created": "2026-08-02",
      "Dependencies": "SYS-003",
      "FURPSPlus": "+S",
      "FitCriterion": "Подписи не-Core issuer не проходят проверку поля issuer для Permit.",
      "ID": "COR-004",
      "ISO25010Characteristic": "Security",
      "Level": "Module",
      "ModelElementRefs": "MOD-CORE;CTX-AUTH;ART-RESOLUTION;ART-PERMIT;ART-CROSSING",
      "Modified": "2026-08-02",
      "Module": "ASET Core",
      "NeedID": "NEED-003",
      "Notes": "",
      "Owner": "Architecture Board",
      "ParentID": "SYS-003",
      "Priority": "MUST",
      "ProfileApplicability": "Core-only+",
      "Rationale": "Derived from NEED-003 and SYS-003.",
      "RequirementType": "Sole authority",
      "Revision": "3",
      "Risk": "High",
      "Statement": "Core должен быть единственным эмитентом authority-bearing Permit; ни approval, delegation receipt, подпись Master или Monade не являются Permit.",
      "Status": "APPROVED_FOR_RC9",
      "Supersedes": "",
      "TargetRelease": "1.5-rc11",
      "VerificationCaseID": "VC-COR-004",
      "VerificationMethod": "Property test"
    },
    {
      "ADRRefs": "ADR-030;ADR-031;ADR-032;ADR-034;ADR-035",
      "Approver": "Project Owner",
      "Created": "2026-08-02",
      "Dependencies": "SYS-003",
      "FURPSPlus": "R",
      "FitCriterion": "Property tests не находят способа использовать Permit на другом gate/actor/execution или второй раз.",
      "ID": "COR-005",
      "ISO25010Characteristic": "Reliability",
      "Level": "Module",
      "ModelElementRefs": "MOD-CORE;CTX-AUTH;ART-RESOLUTION;ART-PERMIT;ART-CROSSING",
      "Modified": "2026-08-02",
      "Module": "ASET Core",
      "NeedID": "NEED-003",
      "Notes": "",
      "Owner": "Architecture Board",
      "ParentID": "SYS-003",
      "Priority": "MUST",
      "ProfileApplicability": "Core-only+",
      "Rationale": "Derived from NEED-003 and SYS-003.",
      "RequirementType": "Permit binding",
      "Revision": "3",
      "Risk": "High",
      "Statement": "Каждый Permit должен быть связан с одним gate type, gate instance, crossing_id, actor/execution_id и maximum_crossings=1.",
      "Status": "APPROVED_FOR_RC9",
      "Supersedes": "",
      "TargetRelease": "1.5-rc11",
      "VerificationCaseID": "VC-COR-005",
      "VerificationMethod": "State test"
    },
    {
      "ADRRefs": "ADR-030;ADR-031;ADR-032;ADR-034;ADR-035",
      "Approver": "Project Owner",
      "Created": "2026-08-02",
      "Dependencies": "SYS-003",
      "FURPSPlus": "F",
      "FitCriterion": "Incomplete, conflicting, stale, expired-at-issuance, overlong-lifetime and unknown input produces zero Permits.",
      "ID": "COR-006",
      "ISO25010Characteristic": "Functional suitability",
      "Level": "Module",
      "ModelElementRefs": "MOD-CORE;CTX-AUTH;ART-RESOLUTION;ART-PERMIT;ART-CROSSING",
      "Modified": "2026-08-02",
      "Module": "ASET Core",
      "NeedID": "NEED-003",
      "Notes": "",
      "Owner": "Architecture Board",
      "ParentID": "SYS-003",
      "Priority": "MUST",
      "ProfileApplicability": "Core-only+",
      "Rationale": "Derived from NEED-003 and SYS-003.",
      "RequirementType": "Default deny",
      "Revision": "3",
      "Risk": "High",
      "Statement": "Core должен применять default deny: всё, что не доказано как основание выдачи точного Permit, приводит к PROHIBITED или отсутствию Permit.",
      "Status": "APPROVED_FOR_RC9",
      "Supersedes": "",
      "TargetRelease": "1.5-rc11",
      "VerificationCaseID": "VC-COR-006",
      "VerificationMethod": "State test"
    },
    {
      "ADRRefs": "ADR-030;ADR-031;ADR-032;ADR-034;ADR-035",
      "Approver": "Project Owner",
      "Created": "2026-08-02",
      "Dependencies": "SYS-003",
      "FURPSPlus": "F",
      "FitCriterion": "Replay документа на зафиксированном policy snapshot воспроизводит тот же verdict и basis.",
      "ID": "COR-007",
      "ISO25010Characteristic": "Functional suitability",
      "Level": "Module",
      "ModelElementRefs": "MOD-CORE;CTX-AUTH;ART-RESOLUTION;ART-PERMIT;ART-CROSSING",
      "Modified": "2026-08-02",
      "Module": "ASET Core",
      "NeedID": "NEED-003",
      "Notes": "",
      "Owner": "Architecture Board",
      "ParentID": "SYS-003",
      "Priority": "MUST",
      "ProfileApplicability": "Core-only+",
      "Rationale": "Derived from NEED-003 and SYS-003.",
      "RequirementType": "Issuance policy",
      "Revision": "3",
      "Risk": "High",
      "Statement": "Core должен поддерживать versioned issuance rules, precedence, supersession, revocation и authority epoch с воспроизводимым basis в Resolution.",
      "Status": "APPROVED_FOR_RC9",
      "Supersedes": "",
      "TargetRelease": "1.5-rc11",
      "VerificationCaseID": "VC-COR-007",
      "VerificationMethod": "Decision table test"
    },
    {
      "ADRRefs": "ADR-030;ADR-031;ADR-032;ADR-034;ADR-035",
      "Approver": "Project Owner",
      "Created": "2026-08-02",
      "Dependencies": "SYS-007",
      "FURPSPlus": "+S",
      "FitCriterion": "При отсутствии receipt — PROHIBITED; после нового документа с receipt возможна новая независимая резолюция.",
      "ID": "COR-008",
      "ISO25010Characteristic": "Security",
      "Level": "Module",
      "ModelElementRefs": "MOD-CORE;CTX-AUTH;ART-RESOLUTION;ART-PERMIT;ART-CROSSING",
      "Modified": "2026-08-02",
      "Module": "ASET Core",
      "NeedID": "NEED-004",
      "Notes": "",
      "Owner": "Architecture Board",
      "ParentID": "SYS-007",
      "Priority": "MUST",
      "ProfileApplicability": "Strict / risk-tier applicable",
      "Rationale": "Derived from NEED-004 and SYS-007.",
      "RequirementType": "Approval basis",
      "Revision": "3",
      "Risk": "High",
      "Statement": "Core должен проверять требуемые human approval receipts как основания выдачи, не превращаясь в workflow engine.",
      "Status": "APPROVED_FOR_RC9",
      "Supersedes": "",